title,response_code,resumen,links,images
¿Se atrasó Colombia en las gestiones para la vacuna de covid-19? - hdl:20.500.12010/11833,200,"['Gracias por tomarse el tiempo para darnos su opinión.', 'Fundación Universitaria de Bogotá Jorge Tadeo Lozano | Vigilada Mineducación', 'Institución de educación superior privada, de utilidad común, sin ánimo de lucro y su carácter académico es el de Universidad.', 'Reconocimiento personería jurídica: Resolución 2613 del 14 de agosto de 1959 Minjusticia.', 'Institución de Educación Superior sujeta a inspección y vigilancia por el Ministerio de Educación Nacional.', '\xa0', '\nTérminos y condiciones\xa0|\xa0Políticas\n', '\xa0', 'Fundación Universitaria de Bogotá Jorge Tadeo Lozano | Vigilada Mineducación', 'Institución de educación superior privada, de utilidad común, sin ánimo de lucro y su carácter académico es el de Universidad.', 'Reconocimiento personería jurídica: Resolución 2613 del 14 de agosto de 1959 Minjusticia.', 'Institución de Educación Superior sujeta a inspección y vigilancia por el Ministerio de Educación Nacional.', '\xa0', '\nTérminos y condiciones\xa0|\xa0Políticas\n', '\xa0']","['/', 'https://expeditiorepositorio.utadeo.edu.co:443/handle/20.500.12010/11833?locale-attribute=es', 'https://expeditiorepositorio.utadeo.edu.co:443/handle/20.500.12010/11833?locale-attribute=en', 'https://expeditiorepositorio.utadeo.edu.co:443/handle/20.500.12010/11833?locale-attribute=pt', '#', '?locale-attribute=es', '?locale-attribute=en', '?locale-attribute=pt', '/ldap-login', '#', '/', '/handle/20.500.12010/2', '/handle/20.500.12010/10356', '/handle/20.500.12010/11350', '#', '/', '/handle/20.500.12010/2', '/handle/20.500.12010/10356', '/handle/20.500.12010/11350', None, '/page/resources', '/page/howtopublish', None, '/page/community-list', '/browse?type=dateissued', '/browse?type=author', '/browse?type=title', '/browse?type=subject', None, '/handle/20.500.12010/11350/browse?type=dateissued', '/handle/20.500.12010/11350/browse?type=author', '/handle/20.500.12010/11350/browse?type=title', '/handle/20.500.12010/11350/browse?type=subject', '/login', '/register', '/handle/20.500.12010/11833/statistics', '/handle/20.500.12010/11833/google-stats', None, '/page/statistics', '/metadata/handle/20.500.12010/11833/mets.xml', '/handle/20.500.12010/11833?show=full', 'http://hdl.handle.net/20.500.12010/11833', 'https://www.eltiempo.com/amp/politica/congreso/vacuna-covid-19-lanzan-alerta-sobre-los-recursos-para-adquisicion-528086', '/handle/20.500.12010/11350', '/page/tyc', '/page/policies', 'http://scholar.google.es/', 'https://www.renata.edu.co/', 'http://www.universia.net.co/', 'http://www.osa.org.co/', 'http://190.242.114.6:8080/web/guest/inicio', 'https://co.creativecommons.org/', '/htmlmap', '/page/tyc', '/page/policies', 'http://scholar.google.es/', 'https://www.renata.edu.co/', 'http://www.universia.net.co/', 'http://www.osa.org.co/', 'http://190.242.114.6:8080/web/guest/inicio', 'https://co.creativecommons.org/', '/htmlmap']","['/themes/Mirage2/images/cliente/logo-utadeo.png', '/bitstream/handle/20.500.12010/11833/Periodico%20El%20Tiempo%20Logo.jpg?sequence=3&isAllowed=y', '/themes/Mirage2/images/cliente/GoogleScholar.png', '/themes/Mirage2/images/cliente/Renata.png', '/themes/Mirage2/images/cliente/Universia.png', '/themes/Mirage2/images/cliente/sayco.png', '/themes/Mirage2/images/cliente/SNAAC.png', '/themes/Mirage2/images/cliente/CreativeCommons.svg', '/themes/Mirage2/images/cliente/GoogleScholar.png', '/themes/Mirage2/images/cliente/Renata.png', '/themes/Mirage2/images/cliente/Universia.png', '/themes/Mirage2/images/cliente/sayco.png', '/themes/Mirage2/images/cliente/SNAAC.png', '/themes/Mirage2/images/cliente/CreativeCommons.svg']"
Por demora en entrega de resultados de covid-19 investigan a 17 EPS,200,"['\nLa Procuraduría General de Nación abrió un proceso disciplinario contra 17 representantes legales de EPS y funcionarios de direcciones de salud departamentales, municipales y distritales, por la mora en la entrega de resultados de más de 70.000 pruebas para covid-19, que en algunos casos superan los 30 días.El órgano de control también investiga presuntas irregularidades en el proceso de toma y embalaje de muestras PCR para diagnóstico del virus del Sars-CoV-2.\n', '\n(Lea también:\xa0Suspenden a profesor de la Distrital señalado de acosar a estudiantes)\n', '\nLa apertura de proceso disciplinario se dio para\xa0los representantes legales de Nueva EPS, Mutual Ser EPS, Comfamiliar Nariño EPS, Emmsanar EPS, Salud Total EPS, Coomeva EPS, Medimás EPS, Famisanar EPS, Comfacundi EPS, Ambuq EPS, Comparta EPS, Compensar EPS, Sanitas EPS, Dirección de Sanidad Militar, Cajacopi EPS, Asmet Salud EPS, Mallamás EPS.\n', '\nAsí como para funcionarios por establecer de las secretarías de salud de 18 departamentos, 4 distritos y 88 municipios.\n', '\nA nivel departamental, informó la Procuraduría, el atraso en la entrega de resultados es de 50.473, siendo Antioquia, con 21.130 el que más pruebas pendientes tiene. En los municipios ese número es de 5.775 y en los distritos de 17.792, para un total de 70.522.\n', '\n(Le puede interesar:\xa0Con un dron ubicaron a el ‘Piloto’, vinculado a crímenes de ‘paras’)\n', '\nDe otro lado, como acción preventiva de vigilancia, la Procuraduría\xa0Delegada para la Salud, la Protección Social y el Trabajo Decente remitió a la Superintendencia Nacional de Salud y a la Contraloría copia del informe que identifica las presuntas irregularidades, para que se evalúe el inicio de las acciones que se determine en cada caso.\n', '\nAsí mismo, pidió a la Supersalud verificar que los laboratorios públicos y privados avalados para el procesamiento de muestras cumplan con sus compromisos, especialmente frente a sus obligaciones en términos de oportunidad y calidad, y en caso contrario, iniciar las acciones administrativas que sean de su competencia.\n', '\n(Además:\xa0Las 3 reformas judiciales que van al Congreso, ¿se logrará aprobación?)\n', '\nIgualmente, se ordenó a los procuradores distritales, regionales y provinciales verificar en las secretarías de salud de sus jurisdicciones hay mecanismos de control que permitan hacer seguimiento a los tiempos en la toma de muestras y entregas de resultados por parte de las administradoras de planes de beneficios.\n', '\nDesde el 25 de marzo, 13 días después de que fuera declarada la Emergencia Sanitaria por el covid-19, la Procuraduría alertó sobre errores en el rotulado, embalaje y traslado de las muestras.\n', '\nTras una visita al Instituto Nacional de Salud - el domingo 22 de marzo - evidenció incumplimiento por parte de las Entidades Territoriales de Salud con embalajes inadecuados, muestras no aptas para el proceso de análisis, mala conservación y fichas epidemiológicas que no cumplían con los requisitos para continuar con el proceso.\n', '\nJUSTICIA\n', '\nEn Twitter: @JusticiaET\n', '\njusticia@eltiempo.com\n']","['', '', '', '', '', '', '', '', '', '', '', '', '/', '/opinion', '#', '/opinion/editorial', '/opinion/caricaturas', 'http://blogs.eltiempo.com/', '/colombia', '#', '/bogota', '/colombia/medellin', '/colombia/barranquilla', '/colombia/cali', '/bogota', '/mundo', '#', '/mundo/latinoamerica', '/mundo/venezuela', '/mundo/eeuu-y-canada', '/mundo/europa', '/mundo/africa', '/mundo/medio-oriente', '/mundo/asia', '/mundo/mas-regiones', '/politica', '#', '/politica/gobierno', '/politica/congreso', '/politica/proceso-de-paz', '/politica/partidos-politicos', '/elecciones-colombia-2018', '/justicia', '#', '/justicia/cortes', '/justicia/conflicto-y-narcotrafico', '/justicia/investigacion', '/justicia/delitos', '/justicia/servicios', '/economia', '#', '/economia/finanzas-personales', '/economia/empresas', '/economia/sectores', '/economia/sector-financiero', '/deportes', '#', '/deportes/futbol-internacional', '/deportes/futbol-colombiano', '/deportes/tenis', '/deportes/ciclismo', '/deportes/automovilismo', '/deportes/otros-deportes', '/cultura', '#', '/cultura/cine-y-tv', '/cultura/arte-y-teatro', '/cultura/musica-y-libros', '/cultura/gastronomia', '/cultura/entretenimiento', '/cultura/gente', '/tecnosfera', '#', '/tecnosfera/apps', '/tecnosfera/dispositivos', '/tecnosfera/videojuegos', '/vida', '#', '/vida/ciencia', '/vida/educacion', '/vida/salud', '/vida/viajar', '/vida/medio-ambiente', '/especiales', '/multimedia/videos', '/multimedia/galeria-de-fotos', '/podcast', '/datos', 'http://www.motor.com.co/', '/carrusel', '/bocas', '/lecturas-dominicales', 'https://www.eltiempo.com/noticias/huella-social', 'http://clasificados.eltiempo.com', '/ayuda', '/pico-y-placa', '/clima', '#', '#', 'http://www.portafolio.co', 'http://vive.in/', 'https://www.futbolred.com/', 'http://alo.co/', 'http://www.motor.com.co/', 'http://diarioadn.co/', 'http://www.carroya.com/', 'http://www.revistadonjuan.com/', 'http://www.loencontraste.com/', 'http://www.citytv.com.co/', 'http://www.abcdelbebe.com/', 'https://clasificados.eltiempo.com/', 'https://www.eltiempo.com/eltiempo-television', 'http://www.elempleo.com/', 'http://www.metrocuadrado.com/', 'http://www.guiaacademica.com/', 'http://www.e-hunters.com/e-hunters', 'http://www.audienciadigital.co/', 'https://www.eltiempo.com/justicia/delitos/suspenden-a-profesor-de-la-universidad-distrital-senalado-de-acosar-a-estudiantes-524744', '/noticias/coronavirus-colombia', '/salud/covid-19-en-colombia-contagios-y-muertes-hoy-9-de-abril-664270', '/salud/covid-19-en-colombia-contagios-y-muertes-hoy-9-de-abril-664270', '/noticias/el-primer-cafe', '/podcast/el-primer-cafe/covid-19-vienen-records-de-casos-diarios-y-analistas-hablan-de-endemia-644096', '/podcast/el-primer-cafe/covid-19-vienen-records-de-casos-diarios-y-analistas-hablan-de-endemia-644096', '/noticias/cali', '/colombia/cali/la-biblioteca-departamental-presta-sus-servicios-en-un-horario-especial-644163', '/colombia/cali/la-biblioteca-departamental-presta-sus-servicios-en-un-horario-especial-644163', 'https://www.eltiempo.com/justicia/conflicto-y-narcotrafico/detalles-de-la-captura-de-alias-el-piloto-vinculado-a-paramilitares-en-antioquia-524878', 'https://www.eltiempo.com/justicia/servicios/analisis-los-tres-proyectos-de-reforma-a-la-justicia-que-van-al-congreso-524866', 'https://twitter.com/justiciaet', None, '/noticias/guillermo-reyes', '/justicia/cortes/plan-retorno-hay-normalidad-y-atencion-a-viajeros-de-ultra-y-viva-757584', '/justicia/cortes/plan-retorno-hay-normalidad-y-atencion-a-viajeros-de-ultra-y-viva-757584', '/noticias/gustavo-petro', '/politica/proceso-de-paz/seguidores-de-gaitan-le-piden-a-petro-terminar-obra-de-centro-cultural-757576', '/politica/proceso-de-paz/seguidores-de-gaitan-le-piden-a-petro-terminar-obra-de-centro-cultural-757576', '/noticias/noticias-et', '/justicia/investigacion/rafael-uribe-noguera-asi-redime-pena-el-asesino-de-yuliana-samboni-757578', '/justicia/investigacion/rafael-uribe-noguera-asi-redime-pena-el-asesino-de-yuliana-samboni-757578', '/noticias/alianza', '/economia/empresas/vestidos-de-bano-colombianos-se-venderan-en-target-757571', '/economia/empresas/vestidos-de-bano-colombianos-se-venderan-en-target-757571', None, '/noticias/dalai-lama', '/mundo/asia/dalai-lama-besa-y-pide-a-nino-que-chupe-su-lengua-polemico-video-757543', '/mundo/asia/dalai-lama-besa-y-pide-a-nino-que-chupe-su-lengua-polemico-video-757543', '/noticias/bogota', '/unidad-investigativa/bogota-la-casa-vecina-a-la-picota-de-donde-salieron-gritos-y-un-muerto-757318', '/unidad-investigativa/bogota-la-casa-vecina-a-la-picota-de-donde-salieron-gritos-y-un-muerto-757318', '/noticias/volcan-nevado-del-ruiz', '/colombia/otras-ciudades/volcan-nevado-del-ruiz-en-vivo-asi-esta-la-actividad-hoy-9-de-abril-757538', '/colombia/otras-ciudades/volcan-nevado-del-ruiz-en-vivo-asi-esta-la-actividad-hoy-9-de-abril-757538', '/noticias/medellin', '/colombia/medellin/medellin-familia-de-mujer-que-no-paga-taxis-buses-ni-comidas-se-pronuncia-757157', '/colombia/medellin/medellin-familia-de-mujer-que-no-paga-taxis-buses-ni-comidas-se-pronuncia-757157', '/noticias/cundinamarca', '/bogota/gobernador-de-cundinamarca-se-queja-de-comandante-de-policia-lo-relevan-757540', '/bogota/gobernador-de-cundinamarca-se-queja-de-comandante-de-policia-lo-relevan-757540', '/', 'https://api.whatsapp.com/send/?phone=573223090079&text&app_absent=0', 'https://www.facebook.com/eltiempo', 'https://twitter.com/eltiempo', 'https://www.instagram.com/eltiempo/', 'https://www.eltiempo.com']",[]
Médicos piden dinero para tratamiento que reduce carga viral de covid,200,"[""\nLos médicos mexicanos Édgar Torres López y Roberto Rebollar\xa0están pidiendo financiación para continuar con las investigaciones de un tratamiento que, aseguran, podría reducir la carga viral de la covid-19.\xa0Tal como informó la edición mexicana de la revista 'Forbes', este consistiría en la aplicación de antisépticos (medicamentos que ayudan a combatir o prevenir los padecimientos infecciosos) a través de nebulizaciones, procedimientos que dividen los medicamentos en microgotas y crean una especie de 'nube' con los mismos.\n"", '\nUna menor concentración del virus permite que si se desarrolla la enfermedad esta sea menos leve.\n', '\nEl descubrimiento, dicen los médicos, podría ayudar a salvar la vida de miles de pacientes afectados por el nuevo coronavirus. \n', '\n(Le puede interesar:\xa0Documentan primer caso de reinfección por Sars-CoV-2).\n', ""\nLa investigación ya fue publicada a finales de julio en un artículo científico del 'International Journal of Innovative Research in Medical' Science que fue celebrado por los colegas de ambos galenos como se ve en una publicación de Facebook de la Fundación Bariátrica Mexicana.\n"", '\n(Si nos lee desde la aplicación vea la publicación de Facebook de la Fundación aquí).\n', ""\nSin embargo, explica 'Forbes', para aplicarlo masivamente necesita pasar un 'Estudio Clínico Aleatorizado' que sirve en este caso para evaluar la seguridad y eficacia del tratamiento propuesto.\xa0\n"", '\nEstos estudios necesitan de voluntarios humanos\xa0y un complejo protocolo que no pueden costear, según le dijo Torres al medio mexicano.\xa0Por eso, piden una inversión de 15 millones de pesos mexicanos que haciendo la conversión a la moneda local equivaldrían a un poco más de 2,6 mil millones de pesos colombianos.\n', ""\nCon el dinero que esperan recaudar de universidades de China, Rusia o la Secretaría de Salud\xa0 mexicana, asegura 'Forbes', podrían llevar el estudio a una segunda fase, es decir, la aprobación y el desarrollo.\n"", '\nAmbos galenos son médicos cirujanos y se encontraban trabajando juntos cuando descubrieron que las nebulizaciones con antisépticos que le hacían a personas con diabetes lograba ""inhibir el (nuevo) (corona)virus"", explica \'Forbes\'.\xa0\n', '\n(Vea también:\xa0Esta es la vacuna experimental para covid que se probará en Colombia).\n', '\nEl éxito del procedimiento para tratar la covid-19 estaría en que, como esta es una enfermedad que ataca principalmente al sistema respiratorio, las nebulizaciones tienen la capacidad de que ""las microgotas (del antiséptico) impregnen por completo la mucosa de la nasofaringe (y reducir la carga viral)"", le contó a ese medio Rebollar en una entrevista.\xa0\n', ""\nNo obstante, para estar seguros de que su descubrimiento pudiera funcionar en un gran número de pacientes con covid-19, lo probaron en el municipio mexicano de Ecatepec en 32 pacientes con cuadros de neumonía o casos sospechosos de covid-19, asegura 'Forbes'.\xa0\n"", '\nPara hacerlo se ampararon en el artículo 37 de la Delaración de Helsinki que regula los principios éticos para las investigaciones médicas en seres humanos. Este texto, se lee en la página de la Asociación Medica Mundial, permite intervenciones no probadas en la práctica clínica no existan otras opciones y si a juicio del médico el tratamiento\xa0no oficial ""da alguna esperanza de salvar la vida, restituir la salud o aliviar el sufrimiento"".\n', ""\nEn efecto, escribe 'Forbes', el único objetivo de este tándem de médicos es ayudar a salvar vidas.\n"", '\n(Le sugerimos leer:\xa0Esta es la verdadera situación que vive un médico en Colombia).\n', '\nPara eso piden la ayuda de la comunidad médica, pues quieren difundir su estudio que podría permitir que el tratamiento pase los ensayos requeridos y que finalmente, sea usado para tratar la covid-19.\n', '\nHasta el 25 de agosto, esta enfermedad ha causa más de 800 mil muertes en el mundo. De estas más de 60.000 ocurrieron en México.\n', '\nTendencias EL TIEMPO\n']","['', '', '', '', '', '', '', '', '', '', '', '', '/', '/opinion', '#', '/opinion/editorial', '/opinion/caricaturas', 'http://blogs.eltiempo.com/', '/colombia', '#', '/bogota', '/colombia/medellin', '/colombia/barranquilla', '/colombia/cali', '/bogota', '/mundo', '#', '/mundo/latinoamerica', '/mundo/venezuela', '/mundo/eeuu-y-canada', '/mundo/europa', '/mundo/africa', '/mundo/medio-oriente', '/mundo/asia', '/mundo/mas-regiones', '/politica', '#', '/politica/gobierno', '/politica/congreso', '/politica/proceso-de-paz', '/politica/partidos-politicos', '/elecciones-colombia-2018', '/justicia', '#', '/justicia/cortes', '/justicia/conflicto-y-narcotrafico', '/justicia/investigacion', '/justicia/delitos', '/justicia/servicios', '/economia', '#', '/economia/finanzas-personales', '/economia/empresas', '/economia/sectores', '/economia/sector-financiero', '/deportes', '#', '/deportes/futbol-internacional', '/deportes/futbol-colombiano', '/deportes/tenis', '/deportes/ciclismo', '/deportes/automovilismo', '/deportes/otros-deportes', '/cultura', '#', '/cultura/cine-y-tv', '/cultura/arte-y-teatro', '/cultura/musica-y-libros', '/cultura/gastronomia', '/cultura/entretenimiento', '/cultura/gente', '/tecnosfera', '#', '/tecnosfera/apps', '/tecnosfera/dispositivos', '/tecnosfera/videojuegos', '/vida', '#', '/vida/ciencia', '/vida/educacion', '/vida/salud', '/vida/viajar', '/vida/medio-ambiente', '/especiales', '/multimedia/videos', '/multimedia/galeria-de-fotos', '/podcast', '/datos', 'http://www.motor.com.co/', '/carrusel', '/bocas', '/lecturas-dominicales', 'https://www.eltiempo.com/noticias/huella-social', 'http://clasificados.eltiempo.com', '/ayuda', '/pico-y-placa', '/clima', '#', '#', 'http://www.portafolio.co', 'http://vive.in/', 'https://www.futbolred.com/', 'http://alo.co/', 'http://www.motor.com.co/', 'http://diarioadn.co/', 'http://www.carroya.com/', 'http://www.revistadonjuan.com/', 'http://www.loencontraste.com/', 'http://www.citytv.com.co/', 'http://www.abcdelbebe.com/', 'https://clasificados.eltiempo.com/', 'https://www.eltiempo.com/eltiempo-television', 'http://www.elempleo.com/', 'http://www.metrocuadrado.com/', 'http://www.guiaacademica.com/', 'http://www.e-hunters.com/e-hunters', 'http://www.audienciadigital.co/', 'www.eltiempo.com/noticias/médicos', 'https://www.forbes.com.mx/', 'www.eltiempo.com/noticias/enfermedad', '/noticias/biopolimeros', '/politica/congreso/medicos-que-utilicen-biopolimeros-pagaran-carcel-segun-proyecto-de-ley-755070', '/politica/congreso/medicos-que-utilicen-biopolimeros-pagaran-carcel-segun-proyecto-de-ley-755070', '/noticias/bbc-ciencia', '/vida/ciencia/a-pacientes-de-retinosis-pigmentaria-les-dan-falsas-esperanzas-751095', '/vida/ciencia/a-pacientes-de-retinosis-pigmentaria-les-dan-falsas-esperanzas-751095', '/noticias/cartagena', '/colombia/otras-ciudades/indignacion-por-hombre-herido-que-ataco-al-personal-de-clinica-en-cartagena-754084', '/colombia/otras-ciudades/indignacion-por-hombre-herido-que-ataco-al-personal-de-clinica-en-cartagena-754084', 'https://www.eltiempo.com/salud/coronavirus-universidad-de-hong-kong-confirma-primer-caso-de-reinfeccion-de-covid-19-en-el-mundo-532694', 'https://ijirms.in/index.php/ijirms/article/view/922?fbclid=IwAR1TUpOKR1yBLqz1f_jTW0MiNwBrEcANacqVSm3R1AwkTp1Dv0Ddx7enzhk#.XyOFBqEgUuu.facebook#fundacionbariatrica', 'https://www.facebook.com/search/posts/?q=Roberto%20Rebollar&epa=SERP_TAB', 'www.eltiempo.com/noticias/moneda', 'www.eltiempo.com/noticias/China', 'https://www.eltiempo.com/salud/vacuna-coronavirus-en-septiembre-inician-pruebas-experimentales-en-colombia-532916', 'www.eltiempo.com/noticias/covid', 'www.eltiempo.com/noticias/entrevista', 'www.eltiempo.com/noticias/neumonía', 'https://www.wma.net/es/policies-post/declaracion-de-helsinki-de-la-amm-principios-eticos-para-las-investigaciones-medicas-en-seres-humanos/', 'https://www.eltiempo.com/colombia/otras-ciudades/coronavirus-en-colombia-esta-es-la-verdadera-situacion-que-vive-un-medico-en-el-pais-528670', None, '/noticias/guillermo-reyes', '/justicia/cortes/plan-retorno-hay-normalidad-y-atencion-a-viajeros-de-ultra-y-viva-757584', '/justicia/cortes/plan-retorno-hay-normalidad-y-atencion-a-viajeros-de-ultra-y-viva-757584', '/noticias/gustavo-petro', '/politica/proceso-de-paz/seguidores-de-gaitan-le-piden-a-petro-terminar-obra-de-centro-cultural-757576', '/politica/proceso-de-paz/seguidores-de-gaitan-le-piden-a-petro-terminar-obra-de-centro-cultural-757576', '/noticias/noticias-et', '/justicia/investigacion/rafael-uribe-noguera-asi-redime-pena-el-asesino-de-yuliana-samboni-757578', '/justicia/investigacion/rafael-uribe-noguera-asi-redime-pena-el-asesino-de-yuliana-samboni-757578', '/noticias/alianza', '/economia/empresas/vestidos-de-bano-colombianos-se-venderan-en-target-757571', '/economia/empresas/vestidos-de-bano-colombianos-se-venderan-en-target-757571', None, '/noticias/dalai-lama', '/mundo/asia/dalai-lama-besa-y-pide-a-nino-que-chupe-su-lengua-polemico-video-757543', '/mundo/asia/dalai-lama-besa-y-pide-a-nino-que-chupe-su-lengua-polemico-video-757543', '/noticias/bogota', '/unidad-investigativa/bogota-la-casa-vecina-a-la-picota-de-donde-salieron-gritos-y-un-muerto-757318', '/unidad-investigativa/bogota-la-casa-vecina-a-la-picota-de-donde-salieron-gritos-y-un-muerto-757318', '/noticias/volcan-nevado-del-ruiz', '/colombia/otras-ciudades/volcan-nevado-del-ruiz-en-vivo-asi-esta-la-actividad-hoy-9-de-abril-757538', '/colombia/otras-ciudades/volcan-nevado-del-ruiz-en-vivo-asi-esta-la-actividad-hoy-9-de-abril-757538', '/noticias/medellin', '/colombia/medellin/medellin-familia-de-mujer-que-no-paga-taxis-buses-ni-comidas-se-pronuncia-757157', '/colombia/medellin/medellin-familia-de-mujer-que-no-paga-taxis-buses-ni-comidas-se-pronuncia-757157', '/noticias/cundinamarca', '/bogota/gobernador-de-cundinamarca-se-queja-de-comandante-de-policia-lo-relevan-757540', '/bogota/gobernador-de-cundinamarca-se-queja-de-comandante-de-policia-lo-relevan-757540', '/', 'https://api.whatsapp.com/send/?phone=573223090079&text&app_absent=0', 'https://www.facebook.com/eltiempo', 'https://twitter.com/eltiempo', 'https://www.instagram.com/eltiempo/', 'https://www.eltiempo.com']",[]
