title,response_code,resumen,links,images
" Carnaval de Barranquilla es aplazado por covid-19 - Barranquilla - Colombia - ELTIEMPO.COM
",200,"['El Carnaval de Barranquilla 2021 quedó aplazado. Así lo anunció en la mañana de este lunes, el alcalde del Distrito, Jaime Pumarejo, quien manifestó que se estarán tomando más decisiones al respecto.', '(Lea también:\xa0Carnaval de Barranquilla 2021 se va perfilando hacia la virtualidad)', 'Las fiestas del próximo año, que estaban programadas entre los días 13 y 16 de febrero, quedaron sin fecha debido a la situación de la pandemia en la ciudad y el país, según indicó el mandatario.""La fiesta está aplazada. La fiesta no será en febrero, no sabemos cuándo será, no sabemos si será en 2021. Lo que sabemos es que en febrero no habrá Carnaval"", dijo Jaime Pumarejo a la Emisora Atlántico.', ""(Le puede interesar:\xa0'Aquarela': los 4 años del mayor escándalo del urbanismo en el país)"", 'El alcalde de Barranquilla agregó que aún es prematuro decidir si se hará el próximo año. En lo que sí insistió es que en febrero están descartados los eventos festivos tradicionales, dada la imposibilidad de hacerlos.Por lo pronto, prepararán a futuro una reunión entre la Alcaldía y Carnaval S.A.S. para tomar nuevas decisiones “en el momento en que sea necesario”.', 'Al avanzar los análisis que viene haciendo el Distrito sobre el futuro inmediato de las carnestolendas, señaló que “lo importante es entender primero que el Carnaval es una tradición cultural más que una fiesta”, y que si bien esta “genera un impacto económico que, por supuesto, valora la ciudad, nadie vive un año de lo que hizo en cuatro días”.De acuerdo con Jaime Pumarejo, la idea es encontrar una manera de contar con esas expresiones, sin poner en peligro la salud de las personas. De esa manera, se buscaría volver al Carnaval como lo era al principio, en casa, “más íntimo”, valorando por sobre todo lo cultural.', '(Le recomendamos:\xa0Así golpeó la pandemia las finanzas públicas de Barranquilla)\xa0', 'En ese sentido, cada hogar conocerá cómo se preparan los grupos, las tradiciones que guardan, el sentir de las danzas, el significado de los atuendos, la razón de la música.Aunque por ahora los indicadores del virus están bajo control en la ciudad, el Distrito comunicó que valora los análisis que han venido haciendo organismos multilaterales sobre los efectos del virus en el mundo, según los cuales por cada mes de epidemia las sociedades tardan un año en volver a la normalidad.', '""Con la realización de los carnavales virtuales, tampoco veíamos un panorama claro, pues nosotros vivimos de los eventos masivos y mientras se conserve la orden de reuniones de máximo 50 personas, los contratos de palcos no son viables"", manifestó Eliana Gómez, empresaria dedicada a los palcos.\xa0El mencionado negocio, que genera miles de empleos directos e indirectos, no se limita además a los cuatro días de Carnaval. Las celebraciones previas como la Guacherna, o los eventos en municipios del Atlántico, representan ingresos importantes. Incluso, encuentros de fin de año como la Gran Parada de la luz.\xa0""Es una serie de pérdidas que tenemos, porque mientras se soluciona la situación, nosotros seguimos pagando personal, mantenimiento y alquiler de bodegas para esas estructuras. Es lógico que la vida prima sobre los negocios, que no tenemos de otra que seguir esperando a que todo se normalice y deseando que la gente entienda y se cuide"", añadió Gómez.\xa0', 'BARRANQUILLA']","['https://www.eltiempo.com/bogota/plan-retorno-de-semana-santa-en-vivo-movilidad-en-cundinamarca-757525', 'https://www.eltiempo.com/bogota/gobernador-de-cundinamarca-se-queja-de-comandante-de-policia-lo-relevan-757540', 'https://www.eltiempo.com/unidad-investigativa/isla-gorgona-lo-que-hay-detras-de-la-supuesta-base-militar-de-ee-uu-757446', 'https://www.eltiempo.com/colombia/otras-ciudades/volcan-nevado-del-ruiz-familias-en-el-viejo-armero-temen-por-emergencia-757533', 'https://www.eltiempo.com/bogota/asi-serian-rutas-para-zonas-de-rumba-en-bogota-despues-de-la-medianoche-757469', 'https://www.eltiempo.com/colombia/otras-ciudades/volcan-nevado-del-ruiz-en-vivo-asi-esta-la-actividad-hoy-9-de-abril-757538', 'https://www.eltiempo.com/deportes/futbol-colombiano/fanaticos-de-millonarios-apedrean-buses-con-hinchas-del-medellin-video-757519', 'https://www.eltiempo.com/deportes/futbol-internacional/lionel-messi-cual-sera-su-futuro-abucheos-en-paris-y-clamor-en-barcelona-757461', 'https://www.eltiempo.com/deportes/futbol-colombiano/millonarios-vs-medellin-resultado-y-goles-liga-betplay-2023-i-fecha-12-757523', 'https://www.eltiempo.com/cultura/cine-y-tv/star-wars-nuevas-peliculas-confirmadas-y-el-regreso-de-daisy-ridley-757447', '', 'https://suscripciones.eltiempo.com/', 'https://www.eltiempo.com/suscripcion-digital', '/opinion', '/opinion', '/opinion/editorial', '/opinion/caricaturas', 'https://blogs.eltiempo.com/', '/colombia', '/bogota', '/colombia/medellin', '/colombia/barranquilla', '/colombia/cali', '/colombia/santander', '/bogota', '/mundo', '/mundo/latinoamerica', '/mundo/venezuela', '/mundo/eeuu-y-canada', '/mundo/europa', '/mundo/africa', '/mundo/medio-oriente', '/mundo/asia', '/mundo/mas-regiones', '/mundo/new-york-times-international-weekly', '/politica', '/politica/gobierno', '/politica/congreso', '/politica/proceso-de-paz', '/politica/partidos-politicos', '/justicia', '/justicia/cortes', '/justicia/conflicto-y-narcotrafico', '/justicia/investigacion', '/justicia/delitos', '/justicia/servicios', '/justicia/jep-colombia', '/justicia/paz-y-derechos-humanos', '/economia', '/economia/finanzas-personales', '/economia/empresas', '/economia/sectores', '/economia/sector-financiero', '/deportes', '/deportes/futbol-internacional', '/deportes/futbol-colombiano', '/deportes/tenis', '/deportes/ciclismo', '/deportes/automovilismo', '/deportes/otros-deportes', '/deportes/copa-america-2019', '/cultura', '/cultura/cine-y-tv', '/cultura/arte-y-teatro', '/cultura/musica-y-libros', '/cultura/gastronomia', '/cultura/entretenimiento', '/cultura/gente', '/tecnosfera', '/tecnosfera/apps', '/tecnosfera/dispositivos', '/tecnosfera/videojuegos', '/ultimas-noticias', '/vida', '/vida/ciencia', '/vida/educacion', '/vida/viajar', '/vida/medio-ambiente', '/vida/mujeres', '/salud', '/unidad-investigativa', '/eltiempoplay', '/especiales', '/multimedia/galeria-de-fotos', '/podcast', '/datos', 'https://www.motor.com.co/', '/carrusel', '/bocas', '/lecturas-dominicales', '/don-juan', 'https://www.eltiempo.com/noticias/huella-social', '/ayuda', '/servicio-al-cliente', 'https://www.ceet.co/linea-etica', '#', 'https://www.portafolio.co', 'https://www.futbolred.com', 'https://www.alo.co', 'https://www.motor.com.co/', 'https://www.diarioadn.co', 'https://www.abcdelbebe.com/', 'https://www.loencontraste.com', 'https://www.citytv.com.co', 'https://clasificados.eltiempo.com', 'https://www.eltiempo.com/eltiempo-television', 'https://www.elempleo.com', 'https://www.metrocuadrado.com', 'https://www.guiaacademica.com', 'https://www.elempleo.com/sitios-empresariales/colombia/e-hunters/candidatos/index.asp', 'https://www.audienciadigital.co', 'https://www.canchasfutbolred.com/', '#', 'https://www.eltiempo.com/eltiempoplay', 'https://eltiempo.com/crucigrama', 'https://eltiempo.com/sudoku', 'https://www.eltiempo.com/eltiempoplay/plutotv', 'https://citytv.eltiempo.com/', 'https://www.eltiempo.com/juegos-mentales', 'https://www.eltiempo.com/condolencias', 'https://api.whatsapp.com/send/?phone=573223090079&text&app_absent=0', 'https://www.facebook.com/eltiempo', 'https://www.instagram.com/eltiempo/', 'https://twitter.com/eltiempo', 'https://www.youtube.com/user/ElTiempoPLAY', '/', 'https://www.eltiempo.com/suscripcion-digital', '/login', 'https://www.eltiempo.com/legal/POLITICA_DE_TRATAMIENTO_Y_PROCEDIMIENTOS_EN_MATERIA_DE_PROTECCION_DE_DATOS_PERSONALES.pdf', '/zona-usuario/configurar-mis-datos', '/zona-usuario/activar', 'https://www.eltiempo.com/suscripcion-digital', '/zona-usuario/mi-suscripcion', '/zona-usuario/version-impresa', '/zona-usuario/articulos-guardados', '/zona-usuario/boletines', '/zona-usuario/club-vivamos', '/preguntas-frecuentes', 'https://www.eltiempo.com/legal/POLITICA_DE_TRATAMIENTO_Y_PROCEDIMIENTOS_EN_MATERIA_DE_PROTECCION_DE_DATOS_PERSONALES.pdf', '/politica-de-cookies', '/colombia', '/bogota', '/colombia/medellin', '/colombia/cali', '/colombia/barranquilla', '/colombia/santander', 'https://www.eltiempo.com/noticias/boyaca', 'https://www.eltiempo.com/noticias/meta', '/colombia/otras-ciudades', '/opinion', '/colombia', '/bogota', '/mundo', '/politica', '/justicia', '/economia', '/deportes', '/cultura', '/tecnosfera', '/vida', '/salud', '/unidad-investigativa', '/eltiempoplay', '/especiales', '/multimedia/galeria-de-fotos', '/podcast', 'https://www.eltiempo.com/condolencias', 'https://citytv.eltiempo.com/', 'https://www.motor.com.co/', '/carrusel', '/bocas', '/lecturas-dominicales', '/libro-fotografia-2020', 'https://www.eltiempo.com/eltiempoplay/plutotv', '/datos', '/zona-usuario/boletines', 'javascript:void(0)', '/zona-usuario/actualizar-email', '/zona-usuario/actualizar-email', 'javascript:void(0)', '#', '/mis-noticias', '/contenido-favorito', '/contenido-favorito', '/mis-noticias', 'https://play.google.com/store/apps/details?id=com.kubo.web', 'https://apps.apple.com/us/app/el-tiempo-noticias/id1002696749?l=es&ls=1', '#', '/mis-noticias', '/mis-noticias', '#', '/mis-noticias', '/mis-noticias', '/', 'https://play.google.com/store/apps/details?id=com.kubo.web', 'https://itunes.apple.com/us/app/el-tiempo-noticias/id1002696749', 'https://www.facebook.com/sharer/sharer.php?u=https://www.eltiempo.com/colombia/barranquilla/carnaval-de-barranquilla-es-aplazado-por-covid-19-545339', 'https://twitter.com/intent/tweet?text=%C2%A1Atenci%C3%B3n!%20Aplazan%20el%20Carnaval%20de%20Barranquilla%202021%20por%20covid-19&url=https://www.eltiempo.com/colombia/barranquilla/carnaval-de-barranquilla-es-aplazado-por-covid-19-545339', 'mailto:', 'https://www.linkedin.com/sharing/share-offsite/?url=https%3A%2F%2Fwww.eltiempo.com%2Fcolombia%2Fbarranquilla%2Fcarnaval-de-barranquilla-es-aplazado-por-covid-19-545339', 'whatsapp://send?text=https%3A%2F%2Fwww.eltiempo.com%2Fcolombia%2Fbarranquilla%2Fcarnaval-de-barranquilla-es-aplazado-por-covid-19-545339?utm_source=whatsapp%26utm_medium=enlace%26utm_campaign=CompartirWhatsapp', None, 'https://www.facebook.com/sharer/sharer.php?u=https://www.eltiempo.com/colombia/barranquilla/carnaval-de-barranquilla-es-aplazado-por-covid-19-545339', 'https://twitter.com/intent/tweet?text=%C2%A1Atenci%C3%B3n!%20Aplazan%20el%20Carnaval%20de%20Barranquilla%202021%20por%20covid-19&url=https://www.eltiempo.com/colombia/barranquilla/carnaval-de-barranquilla-es-aplazado-por-covid-19-545339', 'mailto:', 'https://www.linkedin.com/sharing/share-offsite/?url=https%3A%2F%2Fwww.eltiempo.com%2Fcolombia%2Fbarranquilla%2Fcarnaval-de-barranquilla-es-aplazado-por-covid-19-545339', 'whatsapp://send?text=https%3A%2F%2Fwww.eltiempo.com%2Fcolombia%2Fbarranquilla%2Fcarnaval-de-barranquilla-es-aplazado-por-covid-19-545339?utm_source=whatsapp%26utm_medium=enlace%26utm_campaign=CompartirWhatsapp', '', None, '/noticias/carnaval-de-barranquilla', '/noticias/barranquilla', '/noticias/alcaldia-de-barranquilla', '/noticias/barranquilla', '/login', 'javascript:void(0)', '', None, '/', 'javascript:void(0)', 'https://www.eltiempo.com/colombia/barranquilla/preparan-un-carnaval-2021-virtual-en-barranquilla-539881', 'https://www.eltiempo.com/colombia/otras-ciudades/aquarela-demolicion-del-mayor-escandalo-del-urbanismo-en-el-pais-noticias-de-cartagena-545301', 'https://www.eltiempo.com/colombia/barranquilla/coronavirus-golpeo-las-finanzas-publicas-de-barranquilla-545115', '/colombia/barranquilla/video-del-policia-que-le-habria-disparado-en-la-cabeza-a-un-hombre-en-barranquilla-545315', '/colombia/cali/denuncian-el-asalto-masivo-en-un-restaurante-de-cali-545310', '/colombia/otras-ciudades/en-putumayo-denuncian-incursion-armada-de-grupo-sinaloa-545227', '/noticias/barranquilla', '/login', 'javascript:void(0)', '', None, '/', 'javascript:void(0)', None, '/noticias/carnaval-de-barranquilla', '/noticias/barranquilla', '/noticias/alcaldia-de-barranquilla', '/el-tiempo-ultimas-noticias-colombia-aplicacion-app', '/el-tiempo-ultimas-noticias-colombia-aplicacion-app', '/el-tiempo-ultimas-noticias-colombia-aplicacion-app', None, None, '/noticias/bogota', '/unidad-investigativa/bogota-la-casa-vecina-a-la-picota-de-donde-salieron-gritos-y-un-muerto-757318', '/noticias/dalai-lama', '/mundo/asia/dalai-lama-besa-y-pide-a-nino-que-chupe-su-lengua-polemico-video-757543', '/noticias/volcan-nevado-del-ruiz', '/colombia/otras-ciudades/volcan-nevado-del-ruiz-en-vivo-asi-esta-la-actividad-hoy-9-de-abril-757538', '/noticias/medellin', '/colombia/medellin/medellin-familia-de-mujer-que-no-paga-taxis-buses-ni-comidas-se-pronuncia-757157', '/noticias/cundinamarca', '/bogota/gobernador-de-cundinamarca-se-queja-de-comandante-de-policia-lo-relevan-757540', 'https://www.eltiempo.com/zona-usuario/boletines', 'https://www.eltiempo.com/zona-usuario/boletines', 'https://www.eltiempo.com/terminos-condiciones', 'https://www.eltiempo.com/legal/Autorizacion_DT_USUARIOS_CEET.pdf', 'https://www.eltiempo.com/legal/POLITICA_DE_TRATAMIENTO_Y_PROCEDIMIENTOS_EN_MATERIA_DE_PROTECCION_DE_DATOS_PERSONALES.pdf', 'https://www.eltiempo.com/politica-de-cookies', '/', 'https://seg.eltiempo.com/suscripciones/digital/eltiempodigital?cid=ORG_CON_NA_ET_PAYWALLCONTEO', '/zona-usuario/activar', '/', '/', 'https://www.facebook.com/eltiempo', 'https://twitter.com/eltiempo', 'https://www.youtube.com/user/ElTiempoPLAY', 'https://www.instagram.com/eltiempo/']","['/images/61c2678.png?2303301930', '/images/61c2678.png?2303301930', '/images/eltiempo_logo.png', '/images/google-play-badge.png', '/images/app-store-badge.png', '/images/personalizacion/icon-google-play.png', '/images/personalizacion/icon-app-store.png', '/files/article_main/uploads/2020/10/26/5f96d7a5e2557.jpeg', '/images/1x1.png', '/images/1x1.png', '/images/1x1.png', '/images/1x1.png', 'https://servicios.eltiempo.com/track/pageviews/article-545339', '/images/eltiempo_logo.png']"
